project_id,title,description,tech_stack,start_date,end_date,owner_id
1,Project 1,Sort occur sound cultural case happen.,"Python,Postgres",2024-06-04,2025-03-31,595
2,Project 2,Seat machine than painting whether.,"Node.js,React,Postgres",2024-11-20,2025-08-02,694
3,Project 3,Your often total president.,"Python,Postgres",2024-05-03,2024-12-25,268
4,Project 4,Data use strong.,"Java,Spring,MySQL",2024-07-02,2025-09-07,159
5,Project 5,Of push each could phone.,"Python,PyTorch",2023-12-29,2025-05-26,356
6,Project 6,State ahead term team participant.,"Node.js,React,Postgres",2024-10-07,2025-01-11,606
7,Project 7,Too little size how government new figure.,"Java,Spring,MySQL",2024-10-03,2025-10-01,524
8,Project 8,Contain woman seek.,"Node.js,React,Postgres",2024-06-09,2025-07-26,367
9,Project 9,Idea amount sure partner street contain.,"Node.js,React,Postgres",2024-02-03,2024-12-03,235
10,Project 10,Catch hotel benefit friend realize lead however my.,"Python,TensorFlow",2024-02-14,2025-02-06,76
11,Project 11,My former exactly sister prevent lawyer possible.,"Python,Postgres",2024-01-11,2025-08-16,477
12,Project 12,Benefit deep cultural job friend choose.,"Java,Spring,MySQL",2024-02-11,2025-09-28,548
13,Project 13,With us through teach.,"Python,TensorFlow",2024-06-06,2025-05-26,646
14,Project 14,Nothing politics either image two its.,"Node.js,React,Postgres",2024-02-07,2025-05-17,604
15,Project 15,Boy size meeting.,"Java,Spring,MySQL",2023-12-30,2025-07-26,540
16,Project 16,Space picture process analysis still religious.,"Node.js,React,Postgres",2024-08-09,2025-11-02,110
17,Project 17,Country try shoulder common relate until.,"Python,TensorFlow",2024-07-16,2025-01-30,232
18,Project 18,Tax step treat doctor training write.,"Python,TensorFlow",2024-01-23,2025-05-28,372
19,Project 19,Thank good picture say expect station.,"Python,TensorFlow",2024-10-14,2025-04-13,70
20,Project 20,Ground fear check wife face while.,"Go,Postgres",2024-08-16,2025-01-14,436
21,Project 21,Unit I class policy.,"Node.js,React,Postgres",2024-03-12,2025-07-31,467
22,Project 22,Make kind buy bit.,"Python,TensorFlow",2024-04-04,2025-08-14,554
23,Project 23,Together save Mr school.,"Python,PyTorch",2024-10-12,2025-07-06,687
24,Project 24,During recognize TV together.,"Python,TensorFlow",2024-09-15,2025-10-03,558
25,Project 25,Job generation thought and someone.,"Python,PyTorch",2024-09-26,2025-08-06,611
26,Project 26,Nothing relationship hold sure mission.,"Node.js,React,Postgres",2024-01-05,2025-11-02,454
27,Project 27,Individual industry rich technology campaign mother take person.,"Python,TensorFlow",2024-02-01,2025-07-25,84
28,Project 28,Magazine real near leader house its election.,"Node.js,React,Postgres",2024-05-13,2025-09-07,650
29,Project 29,Her ask society whole pick.,"Python,TensorFlow",2023-12-15,2025-09-26,570
30,Project 30,Morning finally every where.,"Node.js,React,Postgres",2024-06-24,2025-02-21,304
31,Project 31,Last half let soon.,"Node.js,React,Postgres",2024-06-04,2025-03-01,134
32,Project 32,Item up free respond listen.,"Go,Postgres",2024-04-13,2025-03-26,499
33,Project 33,Vote arm especially guess deal director reach.,"Python,PyTorch",2023-12-10,2024-12-29,626
34,Project 34,Network citizen become forget.,"Node.js,React,Postgres",2024-10-07,2025-05-05,649
35,Project 35,Site develop upon page view conference push.,"Go,Postgres",2024-07-30,2024-12-03,104
36,Project 36,Travel white door law.,"Node.js,React,Postgres",2024-09-20,2025-06-30,592
37,Project 37,Green very international song tonight.,"Python,Postgres",2024-06-29,2025-10-23,505
38,Project 38,Paper head role strong.,"Python,TensorFlow",2024-07-01,2025-08-22,193
39,Project 39,Practice sound arm analysis forget.,"Java,Spring,MySQL",2024-03-23,2025-09-22,236
40,Project 40,Region tough kitchen population soon.,"Python,Postgres",2024-10-11,2025-08-25,557
41,Project 41,Product participant school personal step from myself tend.,"Python,Postgres",2024-09-09,2025-10-01,696
42,Project 42,Scene this indeed.,"Node.js,React,Postgres",2024-11-12,2025-05-30,217
43,Project 43,Mention six challenge keep few Mr answer.,"Python,TensorFlow",2023-12-12,2025-06-17,13
44,Project 44,Fall likely believe far from.,"Python,Postgres",2024-04-25,2025-05-27,545
45,Project 45,Team several more these medical.,"Java,Spring,MySQL",2024-04-04,2025-06-22,135
46,Project 46,Crime ten finally prevent.,"Go,Postgres",2024-02-12,2025-04-02,644
47,Project 47,Last cup why finally.,"Python,Postgres",2024-10-29,2025-10-09,208
48,Project 48,Security growth contain their war maybe.,"Python,PyTorch",2024-10-12,2025-01-14,317
49,Project 49,Section appear fish hundred firm imagine.,"Python,Postgres",2024-05-05,2025-02-09,640
50,Project 50,Program idea stock.,"Python,PyTorch",2024-10-12,2025-03-05,134
51,Project 51,Discuss lot remain what over.,"Python,TensorFlow",2024-05-24,2025-04-05,158
52,Project 52,Ok cultural which movie statement.,"Python,PyTorch",2024-07-07,2025-06-18,222
53,Project 53,Good few movement poor painting sound join could.,"Java,Spring,MySQL",2024-08-07,2024-12-01,246
54,Project 54,Identify industry go hotel raise other.,"Python,PyTorch",2024-10-08,2025-09-21,512
55,Project 55,Quite community yeah brother wall camera range.,"Python,Postgres",2024-11-22,2025-08-10,234
56,Project 56,Wide say society trip.,"Python,PyTorch",2024-05-30,2025-02-23,338
57,Project 57,If skin method pretty voice perform.,"Python,PyTorch",2024-01-31,2025-03-11,37
58,Project 58,Young provide hard mouth.,"Go,Postgres",2024-05-12,2025-04-14,359
59,Project 59,Right age accept mission.,"Node.js,React,Postgres",2024-01-13,2025-01-17,115
60,Project 60,Ability within whatever involve science hair test sister.,"Go,Postgres",2024-02-27,2025-06-27,383
61,Project 61,Various good plant beyond staff hotel big.,"Node.js,React,Postgres",2024-07-05,2025-07-29,413
62,Project 62,Partner story glass meet month.,"Python,PyTorch",2024-06-26,2025-09-27,619
63,Project 63,Dark why or agency size.,"Python,PyTorch",2024-09-28,2025-02-15,13
64,Project 64,World simply relate watch serve heart senior.,"Node.js,React,Postgres",2024-10-30,2025-06-10,333
65,Project 65,Whole history type chair more yeah.,"Python,Postgres",2024-06-15,2025-05-07,223
66,Project 66,Perform structure blue training peace provide back community.,"Python,Postgres",2024-05-21,2025-06-21,282
67,Project 67,Environment ten small single.,"Python,TensorFlow",2024-07-27,2025-10-18,443
68,Project 68,Build Democrat stage later police.,"Node.js,React,Postgres",2024-07-31,2025-05-05,605
69,Project 69,Government rate race once.,"Go,Postgres",2024-08-17,2024-12-23,351
70,Project 70,Cultural media analysis husband catch.,"Node.js,React,Postgres",2024-09-22,2025-10-04,332
71,Project 71,Or project very claim reduce thousand house moment.,"Node.js,React,Postgres",2024-04-27,2025-06-12,396
72,Project 72,Look build ten try kid investment.,"Python,PyTorch",2024-06-16,2025-02-03,143
73,Project 73,Material under social ago.,"Node.js,React,Postgres",2024-04-19,2025-02-28,258
74,Project 74,Us son number suggest kind than.,"Java,Spring,MySQL",2024-03-17,2025-10-23,281
75,Project 75,Student movie seat growth.,"Python,PyTorch",2024-07-10,2024-12-24,215
76,Project 76,Figure use draw generation author quickly policy tend.,"Python,Postgres",2024-11-12,2025-09-19,595
77,Project 77,Management analysis community seek.,"Python,Postgres",2023-12-30,2025-01-13,451
78,Project 78,Describe husband whom material product whether.,"Node.js,React,Postgres",2024-11-21,2025-01-04,580
79,Project 79,Know stop his society rise window perhaps.,"Python,PyTorch",2024-08-10,2025-03-09,325
80,Project 80,First serve water check religious remain.,"Python,Postgres",2024-07-06,2025-10-01,497
81,Project 81,When remember indeed between form thing suddenly.,"Java,Spring,MySQL",2024-07-26,2025-04-29,82
82,Project 82,Floor American police baby author accept education.,"Python,TensorFlow",2024-01-31,2025-03-04,27
83,Project 83,Page raise nothing low fly while moment.,"Python,Postgres",2024-01-26,2025-05-18,528
84,Project 84,Prepare box type environment maintain western provide.,"Node.js,React,Postgres",2024-05-10,2025-03-28,401
85,Project 85,Blood wear usually once skill serious case note.,"Go,Postgres",2024-08-18,2025-07-06,580
86,Project 86,Remain build administration thought could.,"Java,Spring,MySQL",2024-10-26,2025-03-05,78
87,Project 87,Economy southern entire door discuss.,"Go,Postgres",2024-10-12,2025-02-25,666
88,Project 88,Environment painting third.,"Java,Spring,MySQL",2023-12-28,2025-04-08,643
89,Project 89,Modern leave identify strategy difficult budget individual.,"Python,TensorFlow",2024-09-05,2025-08-24,618
90,Project 90,Believe early money none.,"Go,Postgres",2024-02-17,2025-04-15,592
91,Project 91,Itself activity head manager TV add.,"Go,Postgres",2024-10-07,2025-11-21,234
92,Project 92,Summer likely anyone war care on part.,"Java,Spring,MySQL",2024-11-09,2025-05-01,480
93,Project 93,History him able city require argue new relate.,"Node.js,React,Postgres",2024-09-17,2025-03-10,147
94,Project 94,Writer idea investment who shoulder week.,"Python,Postgres",2024-05-19,2025-08-21,468
95,Project 95,Theory administration end.,"Go,Postgres",2024-11-18,2025-01-06,2
96,Project 96,Month floor business school them security.,"Python,TensorFlow",2024-03-08,2024-12-31,53
97,Project 97,Respond former quite magazine plant space power.,"Go,Postgres",2024-04-21,2025-01-03,444
98,Project 98,Me firm step within shoulder response poor.,"Python,PyTorch",2024-03-05,2025-03-23,582
99,Project 99,Front model most kitchen certain.,"Node.js,React,Postgres",2024-01-10,2025-06-25,326
100,Project 100,Realize federal risk class class require.,"Python,TensorFlow",2024-10-21,2025-03-09,467
101,Project 101,Yes tree dream loss make.,"Go,Postgres",2024-10-09,2024-12-22,600
102,Project 102,School find heavy look risk fill wrong.,"Go,Postgres",2023-11-30,2025-10-09,324
103,Project 103,Full campaign education value than charge true central.,"Python,Postgres",2024-11-07,2025-09-04,512
104,Project 104,Little trouble bring address language.,"Python,TensorFlow",2024-03-25,2025-07-01,213
105,Project 105,Go once scientist easy television whole.,"Python,PyTorch",2024-09-26,2025-05-17,380
106,Project 106,Poor billion move itself.,"Python,PyTorch",2024-11-09,2025-09-06,635
107,Project 107,Sea heart nor never.,"Python,PyTorch",2024-07-30,2025-08-01,361
108,Project 108,It only measure PM bar miss leave.,"Python,Postgres",2024-01-10,2025-11-11,651
109,Project 109,Wide score often despite sea use push.,"Node.js,React,Postgres",2024-05-06,2025-05-09,662
110,Project 110,Deal guy PM friend camera bit.,"Python,TensorFlow",2024-04-21,2025-10-07,78
111,Project 111,Simple college show.,"Go,Postgres",2024-07-15,2024-12-18,175
112,Project 112,Political information security ahead.,"Python,PyTorch",2024-03-16,2025-07-22,159
113,Project 113,Nice condition understand remain successful relate year.,"Python,PyTorch",2024-08-23,2025-05-25,514
114,Project 114,Choice enough prepare degree.,"Java,Spring,MySQL",2024-01-18,2024-12-24,185
115,Project 115,Exactly child top purpose see serious throw effect.,"Python,TensorFlow",2024-04-18,2025-06-21,135
116,Project 116,List send stage market hope next.,"Go,Postgres",2024-05-23,2025-03-08,422
117,Project 117,Draw top benefit now seat cold.,"Java,Spring,MySQL",2024-02-13,2025-08-14,319
118,Project 118,Resource dream artist another will appear machine.,"Python,Postgres",2024-09-20,2025-01-15,382
119,Project 119,Building over future.,"Python,TensorFlow",2024-11-05,2025-01-31,223
120,Project 120,Subject drive sign them than street.,"Python,PyTorch",2024-03-24,2025-03-09,135
121,Project 121,Born voice road marriage office understand.,"Python,PyTorch",2024-04-26,2025-04-06,353
122,Project 122,Idea pattern drop a economy such answer popular.,"Python,Postgres",2024-09-23,2025-04-11,190
123,Project 123,Bring when similar hair able.,"Node.js,React,Postgres",2024-03-23,2025-11-08,482
124,Project 124,Operation agent worry over.,"Java,Spring,MySQL",2024-11-07,2025-09-02,337
125,Project 125,I see rock deep.,"Python,PyTorch",2024-03-19,2025-02-16,65
126,Project 126,Research college quite mind customer.,"Go,Postgres",2024-11-15,2025-06-03,189
127,Project 127,Improve ready approach detail bad citizen.,"Node.js,React,Postgres",2024-11-07,2025-11-05,561
128,Project 128,Doctor similar significant property of.,"Node.js,React,Postgres",2024-05-17,2025-01-29,431
129,Project 129,Impact protect page until bill have.,"Java,Spring,MySQL",2024-03-13,2025-09-10,324
130,Project 130,Red join dog clear site.,"Python,PyTorch",2024-11-06,2025-07-03,472
131,Project 131,Yourself six agree opportunity.,"Python,TensorFlow",2024-11-24,2025-01-29,117
132,Project 132,Outside will room fly.,"Python,Postgres",2024-03-13,2024-12-09,530
133,Project 133,Whatever economic black carry stay.,"Python,PyTorch",2024-03-04,2025-11-04,569
134,Project 134,Kind fill small hot film.,"Python,Postgres",2024-10-29,2025-11-11,698
135,Project 135,Various feel area.,"Java,Spring,MySQL",2024-10-31,2025-01-17,355
136,Project 136,Truth somebody eat area allow we whom.,"Python,TensorFlow",2024-02-29,2025-07-10,603
137,Project 137,Only development develop bed loss seven.,"Python,Postgres",2023-12-21,2025-06-09,507
138,Project 138,Subject strategy full almost.,"Python,PyTorch",2024-03-27,2025-03-28,486
139,Project 139,National main picture data fire child.,"Go,Postgres",2024-01-26,2025-07-24,277
140,Project 140,Hospital authority house space particular system join.,"Go,Postgres",2024-02-25,2025-09-03,74
141,Project 141,They popular writer hospital send world industry computer.,"Python,PyTorch",2024-08-30,2025-04-25,495
142,Project 142,Glass inside service actually late growth animal.,"Python,Postgres",2024-03-18,2025-06-06,625
143,Project 143,Bad raise board themselves forget.,"Python,PyTorch",2024-11-09,2025-06-27,333
144,Project 144,Interview specific attention claim each product true.,"Node.js,React,Postgres",2024-08-22,2025-05-24,689
145,Project 145,Question lay agreement recently end garden.,"Python,TensorFlow",2024-10-21,2025-07-19,635
146,Project 146,Clear establish base out single company everyone over.,"Python,TensorFlow",2024-11-21,2025-06-17,188
147,Project 147,Talk either ok remember sing machine.,"Python,PyTorch",2024-07-24,2025-07-23,373
148,Project 148,Style parent want while wide break coach.,"Python,PyTorch",2024-08-03,2025-01-21,452
149,Project 149,Attack consider thus late.,"Python,TensorFlow",2024-03-31,2025-01-29,363
150,Project 150,Huge join four night involve education.,"Python,PyTorch",2024-04-14,2024-12-28,164
151,Project 151,Interest pay director white country there.,"Python,TensorFlow",2024-01-15,2025-05-13,686
152,Project 152,Such especially throughout.,"Go,Postgres",2024-08-30,2024-12-30,509
153,Project 153,People general rise weight.,"Python,PyTorch",2024-04-28,2025-01-19,90
154,Project 154,Instead gas determine per save.,"Python,PyTorch",2024-05-12,2025-05-29,222
155,Project 155,Themselves may benefit whole.,"Python,Postgres",2024-04-29,2025-11-07,501
156,Project 156,Big form feeling sport produce example plant.,"Node.js,React,Postgres",2023-11-28,2025-11-25,682
157,Project 157,Check range himself behavior generation.,"Go,Postgres",2024-06-01,2024-11-28,135
158,Project 158,Size reduce position fight program style.,"Python,PyTorch",2024-04-13,2025-05-01,103
159,Project 159,Police employee information reason.,"Python,PyTorch",2024-02-04,2025-04-07,432
160,Project 160,Her six set.,"Python,Postgres",2024-06-27,2025-01-13,31
161,Project 161,Laugh almost magazine drop central weight just.,"Java,Spring,MySQL",2024-02-20,2025-02-28,61
162,Project 162,Safe yes enough executive power avoid still.,"Python,PyTorch",2024-11-10,2025-10-05,419
163,Project 163,Room on individual.,"Go,Postgres",2024-03-24,2025-07-06,335
164,Project 164,Shoulder name minute once million.,"Node.js,React,Postgres",2024-08-26,2025-04-15,296
165,Project 165,Pretty very statement develop lay.,"Python,TensorFlow",2024-10-03,2025-04-03,575
166,Project 166,Education artist whole arm school population responsibility away.,"Go,Postgres",2024-01-02,2025-07-28,73
167,Project 167,Visit particularly team argue.,"Python,TensorFlow",2024-11-03,2025-11-03,101
168,Project 168,Loss head sister series personal.,"Go,Postgres",2024-08-28,2025-11-07,87
169,Project 169,Section training party against change pass.,"Python,PyTorch",2023-12-30,2025-01-08,153
170,Project 170,Price color inside teacher thus.,"Python,PyTorch",2023-12-31,2025-02-02,45
171,Project 171,Including so tree international great.,"Node.js,React,Postgres",2024-03-24,2025-10-05,98
172,Project 172,Tell stay expect PM meeting particularly.,"Java,Spring,MySQL",2023-12-04,2025-04-18,316
173,Project 173,Establish far student most small team.,"Java,Spring,MySQL",2024-07-09,2025-10-09,325
174,Project 174,Loss without low from.,"Go,Postgres",2024-04-06,2025-10-19,163
175,Project 175,About identify husband personal story way school.,"Python,Postgres",2023-12-26,2025-03-26,248
176,Project 176,Tell claim force senior now.,"Python,Postgres",2023-12-03,2024-12-09,121
177,Project 177,Go individual local continue establish service blue.,"Go,Postgres",2024-09-05,2024-12-25,214
178,Project 178,Than when least long radio.,"Java,Spring,MySQL",2024-07-05,2024-12-24,561
179,Project 179,Seven morning place sell.,"Python,TensorFlow",2024-07-07,2025-01-23,568
180,Project 180,State success defense traditional.,"Node.js,React,Postgres",2024-09-16,2025-03-30,105
181,Project 181,Plant laugh pressure before common operation quite.,"Python,PyTorch",2024-07-25,2025-04-28,348
182,Project 182,Sing begin book star Democrat.,"Python,TensorFlow",2024-09-16,2025-01-14,631
183,Project 183,Land car suggest shake partner ever.,"Go,Postgres",2024-04-23,2025-08-27,375
184,Project 184,Notice professional expect energy down next production.,"Go,Postgres",2024-09-29,2025-07-08,406
185,Project 185,Administration single require up heavy red including chair.,"Python,Postgres",2024-11-20,2024-12-18,489
186,Project 186,Manager opportunity style stay public her.,"Python,Postgres",2024-08-23,2024-12-09,211
187,Project 187,Fund structure join myself human several alone.,"Go,Postgres",2024-11-07,2025-01-19,315
188,Project 188,Responsibility senior be clear.,"Java,Spring,MySQL",2024-11-24,2025-07-30,66
189,Project 189,Week animal final factor politics citizen fast.,"Python,PyTorch",2024-10-26,2025-07-31,490
190,Project 190,Through her fight possible teacher.,"Python,PyTorch",2024-04-25,2025-06-04,582
191,Project 191,Night question matter carry.,"Go,Postgres",2024-02-02,2025-01-21,471
192,Project 192,Central wide true event shoulder window.,"Python,Postgres",2024-10-12,2025-04-01,214
193,Project 193,Sea name moment full make.,"Java,Spring,MySQL",2024-06-01,2025-01-27,145
194,Project 194,Evening history when pull.,"Python,Postgres",2024-09-05,2025-06-17,16
195,Project 195,At here long common smile anything.,"Java,Spring,MySQL",2024-09-20,2025-01-11,129
196,Project 196,Economy enough simply mother attorney.,"Node.js,React,Postgres",2024-08-20,2025-06-30,574
197,Project 197,Drop other guess fund.,"Java,Spring,MySQL",2024-03-20,2025-01-20,98
198,Project 198,The party break help political.,"Go,Postgres",2024-01-15,2025-07-21,7
199,Project 199,Star knowledge view sometimes natural rich dark.,"Python,Postgres",2023-11-30,2025-09-22,324
200,Project 200,First former sport challenge.,"Python,Postgres",2024-09-26,2025-05-20,563
